1,Zomerdeals!,Tot 50% korting op geselecteerde items.,banners/summer.jpg,banners/zomer_deals
2,Nieuwe Collectie,Bekijk de nieuwste trends.,banners/New_Collection.webp,banners/new
3,Back to School Actie,Krijg 20% korting op rugzakken en schoolspullen.,banners/Back-to-school.jpg,banners/school
4,Gratis Verzending,Op alle bestellingen boven de €50.,banners/gratis_verzending.jpg,banners/verzending
5,Flash Sale!,Alleen vandaag: 30% korting op alles!,banners/flash_sale.jpg,banners/flash-sale
6,Eindejaarskorting,Bereid je voor op 2026 met kortingen tot 60%.,banners/eindjaar.jpg,banners/eindejaar
7,Laatste Kans!,Nog maar enkele stuks beschikbaar. Wees er snel bij!,banners/laatste-kans.jpg,banners/laatste-kans
